{
  "$schema": "https://json-schema.org/draft/2020-12/schema",
  "$id": "https://example.invalid/lore2mud/character.schema.json",
  "title": "lore2mud character",
  "type": "object",
  "additionalProperties": false,
  "required": [
    "id",
    "name",
    "description",
    "room_id"
  ],
  "properties": {
    "id": {
      "$ref": "common.schema.json#/$defs/stable_id"
    },
    "name": {
      "type": "string",
      "minLength": 1
    },
    "description": {
      "type": "string",
      "minLength": 1
    },
    "room_id": {
      "$ref": "common.schema.json#/$defs/stable_id"
    },
    "canon_ref": {
      "$ref": "common.schema.json#/$defs/canon_ref"
    },
    "adaptation_notes": {
      "type": "string"
    }
  }
}
